<?xml version="1.0" encoding="UTF-8"?>
<!ELEMENT edad (#PCDATA)>
<!ELEMENT foto (#PCDATA)>
<!ELEMENT equipo (persona+)>
<!ELEMENT nombre (#PCDATA)>
<!ELEMENT puesto (#PCDATA)>
<!ELEMENT persona (nombre, apellidos, puesto, edad, foto)>
<!ELEMENT apellidos (#PCDATA)>
